[2025-11-08T17:58:10.530Z] No coverage data collected
[2025-11-08T17:58:11.076Z] No coverage data collected
[2025-11-08T17:58:11.136Z] No coverage data collected
[2025-11-08T17:58:11.146Z] No coverage data collected
[2025-11-08T17:58:11.167Z] No coverage data collected
[2025-11-08T17:58:11.531Z] No coverage data collected
[2025-11-08T17:58:11.594Z] No coverage data collected
[2025-11-08T17:58:11.696Z] No coverage data collected
[2025-11-08T17:58:13.700Z] No coverage data collected
[2025-11-08T17:58:13.735Z] No coverage data collected
[2025-11-08T17:58:14.088Z] No coverage data collected
[2025-11-08T17:58:14.438Z] No coverage data collected
[2025-11-08T17:58:29.371Z] Processing 1040 coverage entries
[2025-11-08T17:58:29.377Z] Processed: scripts/ui/render-to-dom.js
[2025-11-08T17:58:29.379Z] Processed: scripts/board/board.js
[2025-11-08T17:58:29.380Z] Processed: scripts/board/local-datastore.js
[2025-11-08T17:58:29.381Z] Processed: scripts/ui/buffered-observer.js
[2025-11-08T17:58:29.381Z] Processed: scripts/board-items/connector.js
[2025-11-08T17:58:29.904Z] Summary: 38 files processed, 52 skipped
[2025-11-08T17:58:29.923Z] Wrote coverage file: /Users/arienkock/Development/put-it-up/coverage/playwright-cdp/coverage-worker-3.json (38 files)
[2025-11-08T17:58:51.065Z] No coverage data collected
[2025-11-08T17:58:51.934Z] No coverage data collected
[2025-11-08T17:58:51.983Z] No coverage data collected
[2025-11-08T17:58:52.088Z] No coverage data collected
[2025-11-08T17:58:52.157Z] No coverage data collected
[2025-11-08T17:58:52.306Z] No coverage data collected
[2025-11-08T17:58:52.574Z] No coverage data collected
[2025-11-08T17:58:52.579Z] No coverage data collected
[2025-11-08T17:58:53.182Z] No coverage data collected
[2025-11-08T17:58:55.011Z] No coverage data collected
[2025-11-08T17:58:55.923Z] No coverage data collected
[2025-11-08T17:58:56.834Z] No coverage data collected
[2025-11-08T17:59:09.484Z] Processing 960 coverage entries
[2025-11-08T17:59:09.489Z] Processed: scripts/ui/render-to-dom.js
[2025-11-08T17:59:09.490Z] Processed: scripts/board/board.js
[2025-11-08T17:59:09.492Z] Processed: scripts/board/local-datastore.js
[2025-11-08T17:59:09.493Z] Processed: scripts/ui/buffered-observer.js
[2025-11-08T17:59:09.493Z] Processed: scripts/board-items/connector.js
[2025-11-08T17:59:09.965Z] Summary: 38 files processed, 48 skipped
[2025-11-08T17:59:09.986Z] Wrote coverage file: /Users/arienkock/Development/put-it-up/coverage/playwright-cdp/coverage-worker-2.json (38 files)
[2025-11-08T17:59:36.569Z] Processing 96 coverage entries
[2025-11-08T17:59:36.570Z] Summary: 0 files processed, 96 skipped
[2025-11-08T17:59:36.570Z] No coverage data to write after processing
[2025-11-08T17:59:36.938Z] No coverage data collected
[2025-11-08T17:59:36.995Z] No coverage data collected
[2025-11-08T17:59:37.020Z] No coverage data collected
[2025-11-08T17:59:37.128Z] No coverage data collected
[2025-11-08T17:59:37.185Z] No coverage data collected
[2025-11-08T17:59:37.250Z] No coverage data collected
[2025-11-08T17:59:37.318Z] No coverage data collected
[2025-11-08T17:59:37.624Z] No coverage data collected
[2025-11-08T17:59:38.918Z] No coverage data collected
[2025-11-08T17:59:39.321Z] No coverage data collected
[2025-11-08T17:59:40.522Z] No coverage data collected
[2025-11-08T17:59:59.133Z] Processing 3072 coverage entries
[2025-11-08T17:59:59.138Z] Processed: scripts/ui/render-to-dom.js
[2025-11-08T17:59:59.139Z] Processed: scripts/board/board.js
[2025-11-08T17:59:59.140Z] Processed: scripts/board/local-datastore.js
[2025-11-08T17:59:59.140Z] Processed: scripts/ui/buffered-observer.js
[2025-11-08T17:59:59.141Z] Processed: scripts/board-items/connector.js
[2025-11-08T17:59:59.652Z] Summary: 38 files processed, 2084 skipped
[2025-11-08T17:59:59.671Z] Wrote coverage file: /Users/arienkock/Development/put-it-up/coverage/playwright-cdp/coverage-worker-1.json (38 files)
[2025-11-08T18:01:10.946Z] Processing 96 coverage entries
[2025-11-08T18:01:10.947Z] Summary: 0 files processed, 96 skipped
[2025-11-08T18:01:10.947Z] No coverage data to write after processing
[2025-11-08T18:01:11.512Z] No coverage data collected
[2025-11-08T18:01:11.570Z] No coverage data collected
[2025-11-08T18:01:11.601Z] No coverage data collected
[2025-11-08T18:01:11.616Z] No coverage data collected
[2025-11-08T18:01:11.748Z] No coverage data collected
[2025-11-08T18:01:11.934Z] No coverage data collected
[2025-11-08T18:01:12.106Z] No coverage data collected
[2025-11-08T18:01:13.762Z] No coverage data collected
[2025-11-08T18:01:13.850Z] No coverage data collected
[2025-11-08T18:01:13.946Z] No coverage data collected
[2025-11-08T18:01:14.663Z] No coverage data collected
[2025-11-08T18:01:30.443Z] Processing 3080 coverage entries
[2025-11-08T18:01:30.448Z] Processed: scripts/ui/render-to-dom.js
[2025-11-08T18:01:30.449Z] Processed: scripts/board/board.js
[2025-11-08T18:01:30.451Z] Processed: scripts/board/local-datastore.js
[2025-11-08T18:01:30.451Z] Processed: scripts/ui/buffered-observer.js
[2025-11-08T18:01:30.452Z] Processed: scripts/board-items/connector.js
[2025-11-08T18:01:30.971Z] Summary: 38 files processed, 2092 skipped
[2025-11-08T18:01:30.992Z] Wrote coverage file: /Users/arienkock/Development/put-it-up/coverage/playwright-cdp/coverage-worker-3.json (38 files)
